<?xml version="1.0" encoding="utf-8" ?>
<!--<playlist
		xmlns:vls="http://www.videolan.org/vlc/playlist/ns/0/"
		xmlns:xsi="http://www.w3.org/2001/XMLSchema-instance"
		xsi:targetNamespace="http://xspf.org/ns/0/"
		xmlns="http://xspf.org/ns/0/"
		xsi:schemaLocation="mypl.xsd"
		version="1">-->
<playlist
		xmlns:xsi="http://www.w3.org/2001/XMLSchema-instance"
		xsi:schemaLocation="mypl.xsd"
		xmlns:vlc="http://www.videolan.org/vlc/playlist/ns/0/"
		version="1">
	
	<title></title>
		<trackList>
			<track>
				
				<location></location>
				<title></title>
				<album></album>
				<extension application="http://www.videolan.org/vlc/playlist/0">
					<vlc:id>1</vlc:id>
				</extension>
			</track>
		</trackList>
		
		<extension>
			<vlc:item tid="0"/>
		</extension>
</playlist>